{"$defs":{"absolutePath":{"pattern":"^/(?:[A-Za-z0-9._+-]+/)*[A-Za-z0-9._+-]+$","type":"string"},"digest":{"pattern":"^[0-9a-f]{64}$","type":"string"},"digestRef":{"additionalProperties":false,"properties":{"id":{"$ref":"#/$defs/id"},"sha256":{"$ref":"#/$defs/digest"}},"required":["id","sha256"],"type":"object"},"hex32":{"pattern":"^[0-9a-f]{32}$","type":"string"},"hex40":{"pattern":"^[0-9a-f]{40}$","type":"string"},"id":{"pattern":"^[a-z0-9][a-z0-9._-]{0,63}$","type":"string"},"licenseRef":{"additionalProperties":false,"properties":{"decision":{"enum":["affirmative","informational","restricted","user-supplied"]},"id":{"$ref":"#/$defs/id"},"text_sha256":{"$ref":"#/$defs/digest"}},"required":["id","text_sha256","decision"],"type":"object"},"path":{"not":{"pattern":"(?:^|/)(?:\\.|\\.\\.)(?:/|$)|//"},"pattern":"^[a-z0-9][a-z0-9._/-]{0,255}$","type":"string"},"positive":{"maximum":9223372036854775807,"minimum":1,"type":"integer"},"resourcePath":{"not":{"pattern":"(?:^|/)(?:\\.|\\.\\.)(?:/|$)|//"},"pattern":"^[A-Za-z0-9][A-Za-z0-9._/-]{0,255}$","type":"string"},"s64":{"maximum":9223372036854775807,"minimum":0,"type":"integer"},"systemRef":{"additionalProperties":false,"properties":{"id":{"$ref":"#/$defs/id"},"manifest_sha256":{"$ref":"#/$defs/digest"}},"required":["id","manifest_sha256"],"type":"object"},"text":{"maxLength":4096,"minLength":1,"type":"string"},"textMaybeEmpty":{"maxLength":4096,"type":"string"},"u32":{"maximum":4294967295,"minimum":0,"type":"integer"},"u64":{"maximum":18446744073709551615,"minimum":0,"type":"integer"}},"$id":"kilix.content.system-requirements/v1","$schema":"https://json-schema.org/draft/2020-12/schema","additionalProperties":false,"properties":{"architecture":{"enum":["amd64","arm64","riscv64"]},"id":{"$ref":"#/$defs/id"},"manifest_sha256":{"$ref":"#/$defs/digest"},"packages":{"items":{"additionalProperties":false,"properties":{"architecture":{"enum":["amd64","arm64","riscv64"]},"name":{"pattern":"^[a-z0-9][a-z0-9+.-]{0,127}$","type":"string"},"sha256":{"$ref":"#/$defs/digest"},"version":{"pattern":"^[A-Za-z0-9][A-Za-z0-9.+:~_-]{0,255}$","type":"string"}},"required":["name","version","architecture","sha256"],"type":"object"},"maxItems":1024,"type":"array","uniqueItems":true},"release_snapshot":{"additionalProperties":false,"properties":{"distribution":{"const":"debian"},"release_sha256":{"$ref":"#/$defs/digest"},"suite":{"const":"trixie"},"timestamp":{"pattern":"^[0-9]{8}T[0-9]{6}Z$","type":"string"}},"required":["distribution","suite","timestamp","release_sha256"],"type":"object"},"schema":{"const":"kilix.content.system-requirements/v1"}},"required":["schema","id","release_snapshot","architecture","packages","manifest_sha256"],"title":"Kilix system requirements v1","type":"object"}