{"architecture":"amd64","id":"system.test","manifest_sha256":"1181ba241d36d2242a4aebcfd14f685a06ae460fc5a8806f3742d2d20bd4ff11","packages":[{"architecture":"amd64","name":"bubblewrap","sha256":"aab1fb3265df1a36019851cbede56ccf7e7133c50be10e13688e5441657333a4","version":"0.11.0-2"}],"release_snapshot":{"distribution":"debian","release_sha256":"5f23315f79220a0ca8d7872c22d388ac360230dccfc3090fd461b7f0c8bf1049","suite":"trixie","timestamp":"20260821T000000Z"},"schema":"kilix.content.system-requirements/v1"}